{
  "$schema": "https://json-schema.org/draft/2020-12/schema",
  "$id": "https://spec.ariaknowledge.ai/schemas/v0.1/core-manifest.schema.json",
  "title": "Core manifest",
  "description": "Schema for the core.json file at the root of every Core.",
  "type": "object",
  "required": ["core_id", "name", "spec_version", "conformance_level", "license", "publisher", "created", "updated"],
  "additionalProperties": true,
  "properties": {
    "core_id": { "type": "string", "pattern": "^[a-z0-9][a-z0-9-]*[a-z0-9]$" },
    "name": { "type": "string", "minLength": 1 },
    "spec_version": { "type": "string", "pattern": "^[0-9]+\\.[0-9]+\\.[0-9]+(-[a-z]+)?$" },
    "conformance_level": {
      "type": "string",
      "enum": ["core-base", "core-extended", "core-experimental"]
    },
    "license": { "type": "string", "minLength": 1 },
    "publisher": {
      "type": "object",
      "required": ["name", "type"],
      "properties": {
        "name": { "type": "string", "minLength": 1 },
        "type": { "type": "string", "enum": ["individual", "team", "org"] }
      }
    },
    "created": { "type": "string", "format": "date-time" },
    "updated": { "type": "string", "format": "date-time" }
  }
}
